{
  "adoption_feasibility": 3,
  "blocking_unknowns": [],
  "hypothesis_assessments": [
    {
      "adoption_feasibility": 3,
      "artifact_ref": "FEASIBILITY_REPORT.json#H-001",
      "blocking_unknowns": [],
      "feasibility_score": 5,
      "hypothesis_id": "H-001",
      "operational_feasibility": 4,
      "technical_feasibility": 5
    },
    {
      "adoption_feasibility": 3,
      "artifact_ref": "FEASIBILITY_REPORT.json#H-002",
      "blocking_unknowns": [],
      "feasibility_score": 5,
      "hypothesis_id": "H-002",
      "operational_feasibility": 4,
      "technical_feasibility": 5
    },
    {
      "adoption_feasibility": 3,
      "artifact_ref": "FEASIBILITY_REPORT.json#H-003",
      "blocking_unknowns": [],
      "feasibility_score": 5,
      "hypothesis_id": "H-003",
      "operational_feasibility": 4,
      "technical_feasibility": 5
    },
    {
      "adoption_feasibility": 3,
      "artifact_ref": "FEASIBILITY_REPORT.json#H-004",
      "blocking_unknowns": [],
      "feasibility_score": 5,
      "hypothesis_id": "H-004",
      "operational_feasibility": 4,
      "technical_feasibility": 5
    },
    {
      "adoption_feasibility": 3,
      "artifact_ref": "FEASIBILITY_REPORT.json#H-005",
      "blocking_unknowns": [],
      "feasibility_score": 5,
      "hypothesis_id": "H-005",
      "operational_feasibility": 4,
      "technical_feasibility": 5
    }
  ],
  "operational_feasibility": 4,
  "technical_feasibility": 5,
  "type": "FEASIBILITY_REPORT"
}
